title,year,conference
 Exact matrix completion via convex optimization,2009, Proceedings of the26th International Conference on Machine Learning
 Numerical analysis and scientific computation,2004, 2004
 Proximal algorithms,2014, Foundations and Trends in Optimization
 A differential equation for modeling nesterov’saccelerated gradient method: theory and insights,2014, Advances in Neural Information ProcessingSystems 27
 On the importance of initial-ization and momentum in deep learning,2013, Proceedings of the 30th International Conference onMachine Learning
 A variational perspective on acceleratedmethods in optimization,2016, Proceedings of the National Academy of Sciences
 Direct runge-kutta discretizationachieves acceleration,2018, Advances in Neural Information Processing Systems 31
