title,year,conference
 PathNet: Evolution channels gradient descent in superneural networks,2017, arXiv preprint arXiv:1701
 Learning sparse networks using targeted dropout,2019, arXiv preprintarXiv:1905
 Improving neural networks by preventing co-adaptation of feature detectors,2012, arXiv preprintarXiv:1207
 Overcom-ing catastrophic forgetting in neural networks,2017, Proceedings of the National Academy of Sciences(PNAS)
 Learning without forgetting,2017, IEEE Transactions on Pattern Analysisand Machine Intelligence (TPAMI)
