title,year,conference
 Newsweeder: Learning to filter netnews,1995, In Machine Learning Proceedings 1995
 Context-aware advertisement recommendation for high-speed socialnews feeding,2016, In 2016 IEEE 32nd International Conference on Data Engineering (ICDE)
 Online shopping recommender system using hybridmethod,2013, In 2013 International Conference of Information and Communication Technology (ICoICT)
 Deep content-based music recommendation,2643, In Advancesin Neural Information Processing Systems
 Cross-batch negative sampling for training two-tower recommenders,1632, In Pro-ceedings of the 44th International ACM SIGIR Conference on Research and Development in Information Retrieval
 Mixednegative sampling for learning two-tower neural networks in recommendations,2020, In Companion Proceedings of theWeb Conference 2020
