title,year,conference
 Apprenticeship learning via inverse reinforcement learning,2004, InInternational Conference on Machine learning
 Hindsight experience replay,2017, InAdvances in neural information processing systems
 Distributed distributional deterministicpolicy gradients,2018, arXiv preprint arXiv:1804
 A distributional perspective on reinforcementlearning,2017, In International Conference on Machine Learning
 Representation learning: A review and newperspectives,2012, arXiv preprint arXiv:1206
 On theopportunities and risks of foundation models,2021, arXiv preprint arXiv:2108
 Openai gym,2016, arXiv preprint arXiv:1606
 Language models are few-shot learners,2020, arXiv preprintarXiv:2005
 Sample-efficientreinforcement learning with stochastic ensemble value expansion,2018, arXiv preprint arXiv:1807
 Dopamine: A research framework for deep reinforcement learning,2018, arXiv preprintarXiv:1812
 Actionable models:Unsupervised offline reinforcement learning of robotic skills,2021, arXiv preprint arXiv:2104
 Decision transformer: Reinforcement learning via sequencemodeling,2021, arXiv preprint arXiv:2106
 Evaluatinglarge language models trained on code,2021, arXiv preprint arXiv:2107
 Variationalempowerment as representation learning for goal-based reinforcement learning,2021, In InternationalConference on Machine Learning
 Distributional reinforcementlearning with quantile regression,2018, In Thirty-Second AAAI Conference on Artificial Intelligence
 A distributional code for value in dopamine-based reinforcementlearning,2020, Nature
 Transformers for one-shot visual imitation,2020, In Conference onRobot Learning
 On the sample complexityof the linear quadratic regulator,2020, Foundations of Computational Mathematics
 Bert: Pre-training of deepbidirectional transformers for language understanding,2019, arXiv preprint arXiv:1810
 Offline meta learning of exploration,2021, arXiv preprintarXiv:2008
 Animage is worth 16x16 words: Transformers for image recognition at scale,2020, arXiv preprintarXiv:2010
 RL2 : Fastreinforcement learning via slow reinforcement learning,2016, arXiv preprint arXiv:1611
 One-shot imitation learning,2017, In Advances in NeuralInformation Processing Systems
 Diversity is all you need:Learning diverse skills without a reward function,2019, In International Conference on LearningRepresentations
 Rewriting historywith inverse rl: Hindsight inference for policy improvement,2020, In Advances in neural informationprocessing systems
 C-learning: Learning to achievegoals via recursive classification,2021, In International Conference on Learning Representations
 One-shot visual imitationlearning via meta-learning,2017, In Conference on Robot Learning
 Learning robust rewards with adverserial inverse reinforce-ment learning,2018, In International Conference on Learning Representations
 D4RL: datasets for deepdata-driven reinforcement learning,2020, arXiv preprint arXiv:2004
 Addressing function approximation error inactor-critic methods,2018, In International Conference on Machine Learning
 Off-policy deep reinforcement learning withoutexploration,2019, In International Conference on Machine Learning
 Co-adaptation of algorithmic and implementational innovations in inference-based deep reinforcementlearning,2021, In Advances in neural information processing systems
 Policy information capacity: Information-theoretic measure for taskcomplexity in deep reinforcement learning,2021, In International Conference on Machine Learning
 Smile: Scalablemeta inverse reinforcement learning through context-conditional policies,2019, In Advances in NeuralInformation Processing Systems
 A divergence minimizationperspective on imitation learning methods,2020, In Conference on Robot Learning
 Emaq: Expected-maxq-learning operator for simple yet effective offline and online rl,2021, In International Conference onMachine Learning
 Learning to reach goals via iterated supervised learning,2021, In InternationalConference on Learning Representations
 Continuous deep q-learning withmodel-based acceleration,2016, In International Conference on Machine Learning
 Interpolated policy gradient: Merging on-policy and off-policy gradient estimationfor deep reinforcement learning,2017, arXiv preprint arXiv:1706
 Unsupervised meta-learningfor reinforcement learning,2018, arXiv preprint arXiv:1806
 Soft actor-critic: Off-policymaximum entropy deep reinforcement learning with a stochastic actor,2018, In International Conferenceon Machine Learning
 Provably efficient maximumentropy exploration,2019, In International Conference on Machine Learning
 Learningcontinuous control policies by stochastic value gradients,2015, arXiv preprint arXiv:1510
 Generative adversarial imitation learning,2016, In Advances in neuralinformation processing systems
 Reinforcement learning as one big sequence modelingproblem,2021, arXiv preprint arXiv:2106
 Human-centric dialog training via offlinereinforcement learning,2020, arXiv preprint arXiv:2010
 Contex-tual decision processes with low bellman rank are pac-learnable,2017, In International Conference onMachine Learning
 Learning to achieve goals,1993, In International Joint Conference on ArtificialIntelligence
 Imitation learning via off-policy distributionmatching,2020, In International Conference on Learning Representations
 Reward-conditioned policies,2019, arXiv preprintarXiv:1912
 My bodyis a cage: the role of morphology in graph-based incompatible control,2021, In International Conferenceon Learning Representations
 Focal: Efficient fully-offline meta-reinforcement learning viadistance metric learning and behavior regularization,2021, In International Conference on LearningRepresentations
 Generative moment matching networks,2015, In InternationalConference on Machine Learning
 Continuous control with deep reinforcement learning,2016, InInternational Conference on Learning Representations
 Learning latent plans from play,2019, In Conference on Robot Learning
 Offline meta-reinforcement learning with advantage weighting,2021, In International Conference on MachineLearning
 Human-level controlthrough deep reinforcement learning,2015, Nature
 Data-Efficient Hierarchical Reinforce-ment Learning,2018, In Advances in neural information processing systems
 Visualreinforcement learning with imagined goals,2018, arXiv preprint arXiv:1807
 Disco rl: Distribution-conditioned reinforcement learning for general-purpose policies,2021, InInternational Conference on Robotics and Automation
 Stabilizing transformersfor reinforcement learning,2020, In International Conference on Machine Learning
 Asym-metric actor critic for image-based robot learning,2017, arXiv preprint arXiv:1710
 Temporal difference models: Model-free deep rl for model-based control,2018, International Conference on Learning Representations
 Offline meta-reinforcement learning with online self-supervision,2021, arXiv preprint arXiv:2107
 Learning transferable visual models from natural language supervision,2021, arXiv preprintarXiv:2103
 Efficient off-policymeta-reinforcement learning via probabilistic context variables,2019, In International Conference onMachine Learning
 Zero-shot text-to-image generation,2021, arXiv preprint arXiv:2102
 Exploration via hindsight goalgeneration,2019, In Advances in neural information processing systems
 Evolution strategies as ascalable alternative to reinforcement learning,2017, arXiv preprint arXiv:1703
 Dynamics-awareunsupervised discovery of skills,2020, In International conference on learning representations
 S4rl: Surprisingly simple self-supervision foroffline reinforcement learning,2021, arXiv preprint arXiv:2103
 Curl: Contrastive unsupervised representationsfor reinforcement learning,2020, In International Conference on Machine Learning
 The sensory neuron as a transformer: Permutation-invariant neuralnetworks for reinforcement learning,2021, arXiv preprint arXiv:2109
 The gaP between model-based and model-free methods on thelinear quadratic regulator: An asymPtotic viewPoint,2019, In Conference on Learning Theory
 RePresentation learning with contrastive Predictivecoding,2018, arXiv preprint arXiv:1807
 Attention is all you need,2017, In Advances in neural informationprocessing systems
 Learning to reinforcement learn,2016, arXivpreprint arXiv:1611
 Learning a Prior over intentvia meta-inverse reinforcement learning,2019, In International Conference on Machine Learning
 Representation matters: Offline pretraining for sequential decisionmaking,2021, In International Conference on Machine Learning
 Meta-inverse reinforcement learning withprobabilistic context variables,2019, In Advances in Neural Information Processing Systems
 Energy-based hindsight experience prioritization,2018, In Conference onRobot Learning
 Offline meta-reinforcement learning for industrial insertion,2021, arXivpreprint arXiv:2110
 Maximum entropy inversereinforcement learning,2008, In Twenty-Third AAAI Conference on Artificial Intelligence
