title,year,conference
 Layer Normalization,2016, jul 2016
 Neural machine translation by jointlylearning to align and translate,2014, arXiv preprint arXiv:1409
 Long-termRecurrent Convolutional Networks for Visual Recognition and Description,2015, CVpr
 Generating sequences with recurrent neural networks,2013, arXiv preprintarXiv:1308
 Regularizing RNNs by Stabilizing Activations,2015, nov 2015
 A Simple Way to Initialize Recurrent Networksof Rectified Linear Units,1045, arXiv preprint arXiv:1504
 Addressingthe Rare Word Problem in Neural Machine Translation,2014, Arxiv
 Exact solutions to the nonlinear dynam-ics of learning in deep linear neural networks,2013, dec 2013
