title,year,conference
 Spectrally-normalized margin bounds for neuralnetworks,2017, Advances in Neural Information Processing Systems
 Generalization bounds for neural networks via approximate descrip-tion length,2019, Advances in Neural Information Processing Systems
 Vitushkin-type theorems,2014, In Geometric aspects of functionalanalysis
 Size-independent sample complexity ofneural networks,2018, In Conference On Learning Theory
 MNIST handwritten digit database,2010, 2010
 Norm-based capacity control in neuralnetworks,2015, In Conference on Learning Theory
 Exploring general-ization in deep learning,2017, Advances in Neural Information Processing Systems
 Neural networks and rational functions,2017, In International Conference on MachineLearning
 Spectral norm of products of random and deterministic matrices,2011, Probabilitytheory and related fields
