title,year,conference
 Enriching word vectorswith subword information,2017, TACL
 Readingtea leaves: How humans interpret topic models,2009, In Advances in Neural Information ProcessingSystems 22: 23rd Annual Conference on Neural Information Processing Systems 2009
 A neural autoregressive topic model,2012, In Peter L
 Distributed representations of sentences and documents,2014, InProceedings of the 31th International Conference on Machine Learning
 Improving topic models withlatent feature word representations,2015, TACL
 Exploring the space of topic coherencemeasures,2015, In Proceedings of the Eighth ACM International Conference on Web Search and DataMining
 Autoencoding variational inference for topic models,2017, In 5thInternational Conference on Learning Representations
