title,year,conference
 Cross-serial dependenciesin dutch,1530, Linguistic Inquiry
 Three models for the description of language,1956, IRE Transactions on informationtheory
 Turing machines with restricted memory access,1966, Information and Control
 Counter machines and counterlanguages,1433, Mathematical systems theory
 Long short-term memory,1997, Neural Computation
 The convergence of mildly context-sensitivegrammar formalisms,1990, Technical Reports (CIS)
 Assessing the ability of LSTMs to learn syntax-sensitive dependencies,2016, Transactions of the Association for Computational Linguistics
 Sequential neural networks as automata,2019, In Proceedings of the Workshop onDeep Learning and Formal Languages: Building Bridges
 Natural languages and context-free languages,1980, Linguisticsand Philosophy
