title,year,conference
 Robust Physical-World Attacks on Deep Learning Models,2017, 2017
 Explaining and harnessing adversarialexamples,2015, In Proceedings of the International Conference on Learning Representations (ICLR)
 No need to worry about adversarialexamples in object detection in autonomous vehicles,2017, 2017
 Foveation-based mechanismsalleviate adversarial examples,2016, 2016
 Univer-sal adversarial perturbations,2017, In IEEE Conference on Computer Vision and Pattern Recognition(CVPR)
 Accessorize to a crime:Real and stealthy attacks on state-of-the-art face recognition,2016, In Proceedings of the 2016 ACMSIGSAC Conference on Computer and Communications Security
 Intriguing properties of neural networks,2013, 2013
 Re-thinking the inception architecture for computer vision,2015, 2015
