title,year,conference
 Pattern recognition,2006, 2006
 Imagenet classification with deep convo-Iutional neural networks,2012, In Advances in neural information processing systems
 Screening for lung cancer: Us preventive services task force recommendationstatement,2014, Annals of internal medicine
 Brain tumor segmentation usingconvolutional neural networks in mri images,2016, IEEE transactions on medical imaging
 Very deep convolutional networks for large-scale imagerecognition,2014, arXiv preprint arXiv:1409
